{
  "schema_version": 1,
  "profile_id": "hacc-multifile-dataset",
  "profile_version": 1,
  "title": "HACC L380 heterogeneous multi-file scientific dataset workload",
  "classification": {
    "iri_pattern": "data-integration-bulk",
    "workload_kind": "heterogeneous-object-set"
  },
  "scientific_basis": {
    "domain": "computational cosmology",
    "organization": "Argonne National Laboratory / Petascale DTN Project",
    "facility": "ALCF / NCSA / NERSC / OLCF inter-facility DTN environment",
    "workflow": "production-like transfer of a real HACC cosmology simulation dataset between HPC facilities",
    "sources": [
      {
        "source_id": "hacc-throughput-analytics",
        "title": "Throughput Analytics of Data Transfer",
        "url": "https://www.osti.gov/servlets/purl/1509526",
        "supports": [
          "real science data generated by cosmology simulations",
          "19,260 files totaling about 4.4 TB",
          "file sizes from 1 byte to about 11 GB"
        ]
      },
      {
        "source_id": "hacc-l380-distribution",
        "title": "Petascale DTN Project L380 data-set size distribution",
        "url": "https://fasterdata.es.net/assets/Uploads/20190922-0-DataMobility-Intro-v5.pdf",
        "supports": [
          "19,260 files",
          "211 directories",
          "4,442,781,786,482 total bytes",
          "11,313,896,248-byte largest file",
          "published order-of-magnitude file-size histogram"
        ]
      },
      {
        "source_id": "hacc-dataset-doi",
        "title": "HACC L380 Petascale DTN test dataset",
        "url": "https://doi.org/10.34941/S1159N",
        "supports": [
          "persistent identifier for the scientific dataset used by the Petascale DTN project"
        ]
      }
    ]
  },
  "native_workload": {
    "dataset_semantics": "finite-multifile-transfer",
    "dataset_total_objects": 19260,
    "dataset_total_bytes": 4442781786482
  },
  "object_model": {
    "kind": "published-histogram",
    "logical_total_objects": 19260,
    "logical_total_bytes": 4442781786482,
    "directories": 211,
    "smallest_object_bytes": 0,
    "largest_object_bytes": 11313896248,
    "bucket_semantics": "lower-inclusive-upper-exclusive",
    "normalization": "Published order-of-magnitude labels are normalized to contiguous half-open byte ranges for deterministic generation; published bucket counts are preserved exactly.",
    "buckets": [
      {"lower_inclusive": 0, "upper_exclusive": 10, "count": 7},
      {"lower_inclusive": 10, "upper_exclusive": 100, "count": 1},
      {"lower_inclusive": 100, "upper_exclusive": 1000, "count": 59},
      {"lower_inclusive": 1000, "upper_exclusive": 10000, "count": 3170},
      {"lower_inclusive": 10000, "upper_exclusive": 100000, "count": 1560},
      {"lower_inclusive": 100000, "upper_exclusive": 1000000, "count": 2817},
      {"lower_inclusive": 1000000, "upper_exclusive": 10000000, "count": 3901},
      {"lower_inclusive": 10000000, "upper_exclusive": 100000000, "count": 3800},
      {"lower_inclusive": 100000000, "upper_exclusive": 1000000000, "count": 2295},
      {"lower_inclusive": 1000000000, "upper_exclusive": 10000000000, "count": 1647},
      {"lower_inclusive": 10000000000, "upper_exclusive": 100000000000, "count": 3}
    ]
  },
  "content_model": {
    "kind": "deterministic-surrogate",
    "generator": "splitmix64",
    "seed_namespace": "ngi541-scientific-corpus-v1/hacc-multifile-dataset",
    "compressibility_policy": "pseudo-random-uncompressed"
  },
  "supported_execution_modes": [
    "service-envelope",
    "transport-capacity"
  ]
}
